{
  "schema_version": "radiosim.sci005.stage2-acceptance.v1",
  "stage": 2,
  "verdict": "ACCEPT",
  "generated_at_utc": "2026-08-19T11:15:00Z",
  "implementation_identity": "sci005-s2-implementer",
  "reviewer_identity": "sci005-a2-reviewer",
  "reviewer_independent": true,
  "design_sha": "b6d09b732e93f3e5a533eafd6e38b102f26a4eb0",
  "red_test_sha": "da18f96e9dfe1a76851c2800f1c0f80460d3ea89",
  "source_sha": "5c94d925352b389768e0476079e04e811db996e1",
  "evidence_commit_sha": "56f7fd513cf3dd15d93f1176c8fbe2382921e263",
  "evidence_artifact_path": "docs/development/sci005_stage2_evidence.json",
  "evidence_artifact_sha256": "5e3c57eb93c634649e535b02386e1d4211345f23fd851a8a3529480b7c7f1171",
  "evidence_schema_path": "docs/development/sci005_stage2_evidence.schema.json",
  "evidence_schema_sha256": "8d2c0d62236b15996b25c2e3f10eb7a4f601852d564adf95658017ad66385889",
  "toolchain": {
    "evidence_generator_path": "tools/sci005_stage_evidence.py",
    "evidence_generator_git_blob": "9c77ba3e14e91b6fa74561afd556c5130d2df81d",
    "evidence_validator_path": "tests/unit/test_sci005_evidence.py",
    "evidence_validator_git_blob": "5e0045dd91a9346cc6c81a11abda9e0762c04e9f",
    "acceptance_generator_path": "tools/sci005_stage2_acceptance.py",
    "acceptance_generator_git_blob": "75fdc4b21c407e2ad19b615749aee0c66f03f731",
    "acceptance_validator_path": "tests/unit/test_sci005_stage2_acceptance.py",
    "acceptance_validator_pre_a_git_blob": "93c5cd27531f5d31186f325b43a07b5b4112781f",
    "acceptance_schema_path": "docs/development/sci005_stage2_acceptance.schema.json",
    "acceptance_schema_sha256": "4f75b2ce691955d1091fd90b720684b0f665a904c8467bcbcbea65e902fb3adb"
  },
  "acceptance_commit_sha": null,
  "acceptance_commit_sha_reason": "self-reference: U2 and SCI004.M3 bind the containing A2 commit",
  "successor_unlocks": [
    "SCI004.M3",
    "SCI005.U2"
  ],
  "reviewed_artifacts": [
    {
      "path": "docs/development/sci005_beam_physics_plan.md",
      "sha256": "cd5f0c934ac8da0030f0bcee233c98b6eb270b2bfe587cb7457b04ac30629121",
      "source_sha": "5c94d925352b389768e0476079e04e811db996e1",
      "authenticated": true
    },
    {
      "path": "docs/development/sci005_stage2_acceptance.schema.json",
      "sha256": "4f75b2ce691955d1091fd90b720684b0f665a904c8467bcbcbea65e902fb3adb",
      "source_sha": "5c94d925352b389768e0476079e04e811db996e1",
      "authenticated": true
    },
    {
      "path": "docs/development/sci005_stage2_evidence.json",
      "sha256": "5e3c57eb93c634649e535b02386e1d4211345f23fd851a8a3529480b7c7f1171",
      "source_sha": "5c94d925352b389768e0476079e04e811db996e1",
      "authenticated": true
    },
    {
      "path": "docs/development/sci005_stage2_evidence.schema.json",
      "sha256": "8d2c0d62236b15996b25c2e3f10eb7a4f601852d564adf95658017ad66385889",
      "source_sha": "5c94d925352b389768e0476079e04e811db996e1",
      "authenticated": true
    },
    {
      "path": "src/radiosim/core/beam/runtime.py",
      "sha256": "1cb4a208e1d085ac247c0a07dfb74058e2576e8feab4c66c74ba751c82c7b9f6",
      "source_sha": "5c94d925352b389768e0476079e04e811db996e1",
      "authenticated": true
    },
    {
      "path": "tools/sci005_stage_evidence.py",
      "sha256": "64283ccd0615593190511a0b80b3c7e8cd024bf21a21a1cf809c78a89a1a9067",
      "source_sha": "5c94d925352b389768e0476079e04e811db996e1",
      "authenticated": true
    }
  ],
  "rederived_oracles": [
    {
      "oracle_id": "mechanical_feed_rotation",
      "method": "Independently derived beta_feed = wrap(beta_mech + eta*psi + nu*alt) and beta_squint = wrap(beta_feed + pi/2) from Section 4.1/4.2.1 text (own mount-factor table: fixed/equatorial=(0,0), alt-az=(1,0), nasmyth-r=(1,1), nasmyth-l=(1,-1); own Rodrigues rotation about a_p = sin(beta_squint) N - cos(beta_squint) E). For fixed, alt-az (boresight_altitude_rad=1.0, boresight_parallactic_rad=0.7, supplied directly to the public BeamSystem.evaluate_jones keyword arguments), and alt-az+nasmyth-r (altitude=0.6, parallactic=-0.4) with a uniform circular-aperture analytic beam (14 m) and positive_native_feed='y', predicted the displaced response centre and located production's actual peak of |E_00| via a SciPy Nelder-Mead search over (altitude_rad, azimuth_rad) starting from that prediction. Confirmed the search is non-trivial by also starting from zenith and from the opposite-sign (wrong) prediction: both converge to the same true peak, 0.0698 rad (2x the 2 deg feed offset) away from the wrong-sign prediction, so the recovered peak is a genuine, discriminating location rather than the optimizer echoing its start. observed is the max small-angle angular separation between predicted and located centres across the three mount cases.",
      "observed": 1.287007448615977e-09,
      "fixed_limit": 1e-06,
      "units": "rad",
      "passed": true
    },
    {
      "oracle_id": "native_feed_factorization",
      "method": "Independently built C = M(basis) @ R(chi) from Section 4.2.1's formulas (own matrices, not radiosim.core.jones.receptor). Sampled b_plus/b_minus from a squint-FREE plain BeamSystem's scalar evaluate_jones at MY OWN Rodrigues-rotated displaced directions (rotating the off-boresight probe direction itself, not the boresight, by my own R(-sign*delta; a_p)), for a rotated-linear fixture (chi=27.3 deg, positive_native_feed='x') and a circular fixture (chi=15 deg, positive_native_feed='r'), both at 170 MHz against a 150 MHz reference offset of 2 deg. Computed my own expected = C^dagger @ diag(b0,b1) @ C and compared entrywise to the composed E returned by the squint-enabled production BeamSystem.evaluate_jones at the same probe direction and matching boresight_parallactic_rad=0.0/boresight_altitude_rad=pi/2. For the circular case also independently verified the Section 4.2 identity E == (b0+b1)/2 * I2 - (b0-b1)/2 * sigma_y and exact commutation with a real rotation R(0.9 rad). Also cross-checked, using only the b_plus/b_minus values already stored in the retained extended_precision_native_feed_factorization evidence row (a circular, chi=0 case), that my own closed-form (b0+b1)/2 and (b0-b1)/2 reproduce the row's recorded expected.maximum_abs (0.5700171390542352) and expected.minimum_abs (0.2573210780036615) exactly, as internal-consistency authentication of that complex256 row (see accepted_limitations). observed is the max of the four residuals (linear factorization, circular factorization, circular identity, circular commutation).",
      "observed": 1.117495626430756e-16,
      "fixed_limit": 1e-09,
      "units": "dimensionless_voltage",
      "passed": true
    },
    {
      "oracle_id": "noncommuting_chain_order",
      "method": "Reused the rotated-linear fixture above (chi=27.3 deg, positive_native_feed='x', 170 MHz) to obtain production's composed E (from squint-enabled BeamSystem.evaluate_jones) and my own independently sampled b0, b1 (own Rodrigues-rotated directions, own scalar samples from the squint-free BeamSystem). Built my own C = M(linear) @ R(chi) and a nontrivial real rotation P = R(1.234 rad) using jones/parallactic.py's documented but independently-transcribed R(a) = [[cos a, sin a], [-sin a, cos a]] form (a pure algebraic choice, not tied to real sky geometry). Computed CEP = C @ E @ P, DbCP = diag(b0,b1) @ C @ P, and CPE = C @ P @ E with plain NumPy matrix products. Verified inside this method that |CEP - CPE|_max = 0.0855, which is >= 1e-3 (the Section 8.1 order-matters separation bound), confirming the two orders are measurably different for this rotated-linear fixture. observed is max|CEP - DbCP|.",
      "observed": 1.1102230246251565e-16,
      "fixed_limit": 1e-09,
      "units": "dimensionless_voltage",
      "passed": true
    },
    {
      "oracle_id": "squint_frequency_law",
      "method": "Independently transcribed the exact Cotton/Uson law delta(nu) = asin[(nu_ref/nu) sin(delta_ref)] and the small-angle limit from Section 4.1. For a fixed-mount, uniform circular-aperture fixture (mechanical angle 35 deg, per-feed reference offset 2 deg at 150 MHz, positive_native_feed='y') evaluated at four frequencies (100, 150, 200, 240 MHz), located production's actual response peak via a SciPy Nelder-Mead search on |E_00| at each frequency (search seeded at my own arcsine-law prediction) and recovered the offset as the angular separation between the located peak and the zenith boresight -- an independent, peak-finding measurement, not a read-back of production's internal delta(nu). observed is the max abs difference between the recovered offset and my own exact arcsine-law prediction across the four frequencies. Also confirmed the small-angle approximation is distinguishable from both the exact law and the recovered offset: at 240 MHz (furthest from the 150 MHz reference) the small-angle law differs from the exact law by 2.70e-6 rad and from the recovered offset by 2.70e-6 rad, both roughly 1900x the observed peak-finding residual.",
      "observed": 1.4211221713300581e-09,
      "fixed_limit": 1e-06,
      "units": "rad",
      "passed": true
    }
  ],
  "review_checks": [
    {
      "check_id": "artifact_authentication",
      "method": "Computed sha256 of the raw git blob (git cat-file -p 56f7fd5:<path> | shasum -a 256) at E2 for every path in the evidence JSON's artifacts array (docs/development/sci005_beam_physics_plan.md, docs/development/sci005_stage2_evidence.schema.json, src/radiosim/core/beam/runtime.py, tools/sci005_stage_evidence.py), for the evidence JSON itself (docs/development/sci005_stage2_evidence.json), and for docs/development/sci005_stage2_acceptance.schema.json; compared every digest to the JSON's own recorded sha256 fields and to the APPROVED_STAGE2_EVIDENCE_ARTIFACT_SHA256 sentinel now bound in tests/unit/test_sci005_evidence.py.",